{
  "$schema": "https://json-schema.org/draft/2020-12/schema",
  "$id": "https://ai-governance-framework/schemas/closeout_receipt.schema.json",
  "title": "CloseoutReceipt",
  "type": "object",
  "additionalProperties": false,
  "required": [
    "schema_version",
    "timestamp",
    "agent_id",
    "trigger_mode",
    "entrypoint",
    "exit_code",
    "closeout_artifact_path",
    "checksum_of_cleaned_path",
    "memory_eligibility_evaluated",
    "memory_write_required",
    "memory_write_performed",
    "memory_eligibility_reason"
  ],
  "properties": {
    "r2_binding": {
      "type": "object",
      "additionalProperties": false,
      "required": [
        "schema_version",
        "consumer_root",
        "session_id",
        "generation",
        "candidate_identity",
        "expected_text_digest",
        "receipt_identity"
      ],
      "properties": {
        "schema_version": {
          "const": "1.0"
        },
        "consumer_root": {
          "type": "string",
          "minLength": 1
        },
        "session_id": {
          "type": "string",
          "pattern": "^[A-Za-z0-9][A-Za-z0-9_-]{0,127}$"
        },
        "generation": {
          "type": "integer",
          "minimum": 1
        },
        "candidate_identity": {
          "type": "object",
          "additionalProperties": false,
          "required": [
            "relative_path",
            "sha256"
          ],
          "properties": {
            "relative_path": {
              "type": "string",
              "minLength": 1
            },
            "sha256": {
              "type": "string",
              "pattern": "^[0-9a-f]{64}$"
            }
          }
        },
        "expected_text_digest": {
          "type": "string",
          "pattern": "^[0-9a-f]{64}$"
        },
        "receipt_identity": {
          "type": "string",
          "pattern": "^[0-9]{8}T[0-9]{12}Z_r2_[0-9a-f]{32}$"
        }
      }
    },
    "schema_version": {
      "type": "string",
      "enum": ["1.0", "1.1", "1.2", "1.3", "1.4", "1.5"]
    },
    "timestamp": {
      "type": "string",
      "format": "date-time"
    },
    "agent_id": {
      "type": "string",
      "minLength": 1
    },
    "session_id": {
      "type": "string"
    },
    "trigger_mode": {
      "type": "string",
      "enum": [
        "native_hook",
        "manual_fallback",
        "wrapper",
        "synthetic_smoke",
        "unknown"
      ]
    },
    "entrypoint": {
      "type": "string",
      "minLength": 1
    },
    "exit_code": {
      "type": "integer",
      "minimum": 0
    },
    "hook_outcome": {
      "type": "object",
      "additionalProperties": false,
      "required": ["ok", "gate_blocked", "errors"],
      "properties": {
        "ok": { "type": "boolean" },
        "gate_blocked": { "type": "boolean" },
        "errors": { "type": "array", "items": { "type": "string" } }
      },
      "description": "Optional captured outer run_session_end_hook outcome for this receipt's session, HEAD and artifact. Unlike exit_code (pipeline ran), this records hook success and gate state directly. Absent on legacy or incomplete results: success is unproven, never inferred. Part of the exact receipt bytes preserved by tail recovery; does not change ownership/release eligibility."
    },
    "linked_head_commit": {
      "type": "string"
    },
    "closeout_artifact_path": {
      "type": "string"
    },
    "checksum_of_cleaned_path": {
      "type": "string"
    },
    "memory_eligibility_evaluated": {
      "type": "boolean"
    },
    "memory_write_required": {
      "type": "boolean"
    },
    "memory_write_performed": {
      "type": "boolean"
    },
    "memory_eligibility_reason": {
      "type": "string"
    },
    "daily_memory_write_attempted": {
      "type": "boolean",
      "description": "Whether session_end entered the canonical daily-memory writer path."
    },
    "daily_memory_write_status": {
      "type": "string",
      "enum": ["written", "already_present", "skipped", "failed"],
      "description": "Authoritative outcome of the canonical daily-memory writer."
    },
    "daily_memory_state_status": {
      "type": "string",
      "enum": ["satisfied", "unsatisfied", "not_required"],
      "description": "Whether the required daily-memory state exists, is missing, or was not required."
    },
    "daily_memory_path": {
      "type": "string",
      "description": "Exact writer-returned path; empty when no canonical record was produced or reused."
    },
    "daily_memory_record_identity": {
      "type": "string",
      "description": "SHA-256 identity aligned with the canonical writer deduplication key; empty when no record is claimed."
    },
    "daily_memory_writer": {
      "type": "string",
      "const": "governance_tools.memory_record",
      "description": "Canonical writer identifier selected by session_end."
    },
    "daily_memory_write_error": {
      "type": "string",
      "description": "Sanitized writer failure category; empty for non-failed outcomes."
    },

    "output_mode_requested": {
      "type": "string",
      "description": "The mode requested by the agent before enforcement."
    },
    "output_mode_effective": {
      "type": "string",
      "description": "The mode actually permitted after ceiling enforcement (actual_mode from enforcer)."
    },
    "output_mode_decision": {
      "type": "string",
      "enum": ["allow", "degrade", "block"],
      "description": "enforcement_action from enforce_output_mode."
    },
    "output_mode_ceiling": {
      "type": "string",
      "description": "Maximum admissible mode computed by enforce_output_mode from the record."
    },
    "consequence_tier": {
      "type": "integer",
      "enum": [0, 1, 2],
      "description": "Consequence Materiality Tier from the downgrade record (0=cosmetic, 1=procedural, 2=structural)."
    },
    "consequence_materiality_reason": {
      "type": "string",
      "description": "Human-readable reason for the consequence tier classification."
    },
    "enforcement_source": {
      "type": "string",
      "const": "output_mode_enforcer",
      "description": "Identifies which module produced the output_mode decision. Locked to prevent receipt-local ceiling recomputation."
    },
    "fallback_weakens_enforcement": {
      "type": "boolean",
      "const": false,
      "description": "Always false. Manual fallback uses the same enforcer and semantics as native hook path."
    },
    "manual_fallback_reason": {
      "type": "string",
      "description": "Reason native hook was unavailable (e.g. non_native_hook_agent, hook_install_failed)."
    },

    "memory_write_claim_verified": {
      "type": "boolean",
      "description": "Whether the authoritative daily-memory outcome was verified against its exact path, identity, writer, or failure shape."
    },
    "memory_write_claim_verification_reason": {
      "type": "string",
      "description": "Reason emitted by memory write claim verification."
    },
    "memory_authority_guard_ran": {
      "type": "boolean",
      "description": "Whether the memory authority guard ran during closeout."
    },
    "memory_authority_scope": {
      "type": "string",
      "description": "Scope reported by the memory authority guard."
    },
    "memory_authority_warning_codes": {
      "type": "array",
      "items": { "type": "string" },
      "description": "Warning codes reported by the memory authority guard."
    },
    "memory_unbound_count": {
      "type": "integer",
      "minimum": 0,
      "description": "Count of unbound memory entries reported by the memory authority guard."
    },
    "memory_authority_baseline_id": {
      "type": "string",
      "description": "Baseline id used for warning aggregation; empty when no frozen baseline exists."
    },
    "memory_authority_new_since_baseline": {
      "type": "integer",
      "minimum": 0,
      "description": "Warning debt above the frozen baseline (advisory; full count when no baseline)."
    },
    "memory_authority_suppressed_by_baseline": {
      "type": "integer",
      "minimum": 0,
      "description": "Historical warning debt aggregated by the frozen baseline instead of being listed per session."
    },
    "memory_authority_new_warning_codes": {
      "type": "array",
      "items": { "type": "string" },
      "description": "High-salience warning codes: above-baseline debt, active findings, and codes the baseline cannot bank."
    },
    "memory_workflow_dispatch_ran": {
      "type": "boolean",
      "description": "Whether the memory workflow dispatcher ran during closeout."
    },
    "memory_workflow_status": {
      "type": "string",
      "description": "Status reported by the memory workflow dispatcher."
    },
    "memory_task_classification": {
      "type": "string",
      "description": "Task classification reported by the memory workflow dispatcher."
    },
    "memory_completion_claim_allowed": {
      "type": "boolean",
      "description": "Whether the memory workflow dispatcher allowed a memory completion claim."
    },
    "memory_workflow_warning_codes": {
      "type": "array",
      "items": { "type": "string" },
      "description": "Warning codes reported by the memory workflow dispatcher."
    },
    "memory_workflow_blocker_codes": {
      "type": "array",
      "items": { "type": "string" },
      "description": "Blocker codes reported by the memory workflow dispatcher."
    },
    "memory_workflow_guard_summary": {
      "type": "object",
      "additionalProperties": true,
      "description": "Guard summary forwarded through the memory workflow dispatcher."
    },

    "runtime_profile_id": {
      "type": "string",
      "description": "Full fingerprint id from runtime_identity.schema.json (drift marking only); 'unknown' when detection was unavailable."
    },
    "runtime_profile_coarse_id": {
      "type": "string",
      "description": "Coarse fingerprint id (agent_family + model_family + surface_class) used for sample accumulation; 'unknown' when undetected."
    },
    "runtime_detection_status": {
      "type": "string",
      "enum": ["full", "partial", "none", "unknown"],
      "description": "Detection status copied from the runtime identity profile; 'unknown' for receipts written without a profile."
    },
    "sample_origin": {
      "type": "string",
      "enum": ["natural_task", "benchmark", "regression_test", "synthetic", "unknown"],
      "description": "Only natural_task samples feed evaluation main metrics; other origins are debug context."
    },
    "validator_signal": {
      "type": "object",
      "additionalProperties": false,
      "required": ["tier", "tier_source"],
      "properties": {
        "validator_id": { "type": "string" },
        "validator_version": { "type": "string" },
        "tier": {
          "type": "string",
          "enum": ["test_backed", "structural_only", "self_reported", "unknown"],
          "description": "Trustworthiness class of the validation signal. Derived from a versioned validator registry — never agent-filled. No registry entry means 'unknown'."
        },
        "tier_source": {
          "type": "string",
          "description": "Registry id and version the tier was derived from, e.g. 'governance-validator-registry-v1'."
        }
      },
      "description": "Registry-derived trust class of the validator behind validation claims in this receipt."
    }
  },

  "allOf": [
    {"if": {"required": ["r2_binding"], "properties": {}}, "then": {"properties": {"schema_version": {"const": "1.5"}}}},
    {
      "if": {
        "properties": { "trigger_mode": { "const": "manual_fallback" } }
      },
      "then": {
        "required": [
          "output_mode_requested",
          "output_mode_effective",
          "output_mode_decision",
          "output_mode_ceiling",
          "enforcement_source",
          "fallback_weakens_enforcement",
          "manual_fallback_reason"
        ]
      }
    },
    {
      "if": {
        "properties": {
          "schema_version": {
            "enum": ["1.4", "1.5"]
          }
        }
      },
      "then": {
        "required": ["runtime_detection_status", "sample_origin"]
      }
    },
    {
      "if": {
        "properties": {
          "schema_version": {
            "const": "1.5"
          }
        }
      },
      "then": {
        "required": [
          "daily_memory_write_attempted",
          "daily_memory_write_status",
          "daily_memory_state_status",
          "daily_memory_path",
          "daily_memory_record_identity",
          "daily_memory_writer",
          "daily_memory_write_error"
        ]
      }
    },
    {
      "if": {
        "required": ["daily_memory_write_status"],
        "properties": {
          "schema_version": { "const": "1.5" },
          "daily_memory_write_status": { "const": "written" }
        }
      },
      "then": {
        "properties": {
          "daily_memory_write_attempted": { "const": true },
          "daily_memory_state_status": { "const": "satisfied" },
          "memory_write_performed": { "const": true },
          "daily_memory_path": { "minLength": 1 },
          "daily_memory_record_identity": {
            "pattern": "^[0-9a-f]{64}$"
          },
          "daily_memory_write_error": { "const": "" }
        }
      }
    },
    {
      "if": {
        "required": ["daily_memory_write_status"],
        "properties": {
          "schema_version": { "const": "1.5" },
          "daily_memory_write_status": { "const": "already_present" }
        }
      },
      "then": {
        "properties": {
          "daily_memory_write_attempted": { "const": true },
          "daily_memory_state_status": { "const": "satisfied" },
          "memory_write_performed": { "const": false },
          "daily_memory_path": { "minLength": 1 },
          "daily_memory_record_identity": {
            "pattern": "^[0-9a-f]{64}$"
          },
          "daily_memory_write_error": { "const": "" }
        }
      }
    },
    {
      "if": {
        "required": ["daily_memory_write_status"],
        "properties": {
          "schema_version": { "const": "1.5" },
          "daily_memory_write_status": { "const": "skipped" }
        }
      },
      "then": {
        "properties": {
          "daily_memory_write_attempted": { "const": false },
          "daily_memory_state_status": {
            "enum": ["unsatisfied", "not_required"]
          },
          "memory_write_performed": { "const": false },
          "daily_memory_path": { "const": "" },
          "daily_memory_record_identity": { "const": "" },
          "daily_memory_write_error": { "const": "" }
        }
      }
    },
    {
      "if": {
        "required": ["daily_memory_write_status"],
        "properties": {
          "schema_version": { "const": "1.5" },
          "daily_memory_write_status": { "const": "failed" }
        }
      },
      "then": {
        "properties": {
          "daily_memory_write_attempted": { "const": true },
          "daily_memory_state_status": { "const": "unsatisfied" },
          "memory_write_performed": { "const": false },
          "daily_memory_path": { "const": "" },
          "daily_memory_record_identity": { "const": "" },
          "daily_memory_write_error": { "minLength": 1 }
        }
      }
    }
  ]
}
